{
  "schema_version": "1.0",
  "task": {
    "id": "US-001.TASK-001",
    "type": "functional",
    "ref": "metaflow/12-functional/tasks/US-001.TASK-001-engine-transformacion.md",
    "sources": [
      "metaflow/12-functional/user-stories/US-001-toolkit-transformacion.md",
      "metaflow/11-adrs/ADR-001-toolkit-transformacion.md"
    ],
    "generation": {
      "created_at": "2026-08-27T01:20:26-03:00",
      "created_by": "human:eugenioserrano",
      "runs": [
        {
          "tool": "opencode",
          "provider": "deepseek",
          "model": "deepseek/deepseek-v4-flash",
          "tokens": {
            "input_uncached": null,
            "input_cached_read": null,
            "input_cache_write": null,
            "output": null
          },
          "agent": null
        }
      ],
      "duration_seconds": null
    },
    "review_ready_at": "2026-08-27T01:20:26-03:00",
    "review_started_at": "2026-08-27T01:23:11-03:00",
    "acceptance": {
      "review_ready_at": "2026-08-27T02:06:25-03:00",
      "review_started_at": "2026-08-27T02:06:25-03:00"
    }
  },
  "spec_revisions": [
    {
      "revision": 1,
      "ref": "metaflow/21-spec/SPEC-260827-0124-bolt001-engine-transformacion.md",
      "sources": [
        "metaflow/12-functional/tasks/US-001.TASK-001-engine-transformacion.md",
        "metaflow/12-functional/user-stories/US-001-toolkit-transformacion.md",
        "metaflow/11-adrs/ADR-001-toolkit-transformacion.md"
      ],
      "git_commit": null,
      "generation": {
        "created_at": "2026-08-27T01:30:09-03:00",
        "created_by": "human:eugenioserrano",
        "runs": [
          {
            "tool": "opencode",
            "provider": "deepseek",
            "model": "deepseek/deepseek-v4-flash",
            "tokens": {
              "input_uncached": null,
              "input_cached_read": null,
              "input_cache_write": null,
              "output": null
            },
            "agent": null
          }
        ],
        "duration_seconds": null
      },
      "review_ready_at": "2026-08-27T01:24:39-03:00",
      "review_started_at": "2026-08-27T01:30:09-03:00"
    },
    {
      "revision": 2,
      "ref": "metaflow/21-spec/SPEC-260827-0124-bolt001-engine-transformacion.md",
      "sources": [
        "metaflow/12-functional/tasks/US-001.TASK-001-engine-transformacion.md",
        "metaflow/12-functional/user-stories/US-001-toolkit-transformacion.md",
        "metaflow/11-adrs/ADR-001-toolkit-transformacion.md"
      ],
      "git_commit": null,
      "generation": {
        "created_at": "2026-08-27T01:37:26-03:00",
        "created_by": "human:eugenioserrano",
        "runs": [
          {
            "tool": "opencode",
            "provider": "deepseek",
            "model": "deepseek/deepseek-v4-flash",
            "tokens": {
              "input_uncached": null,
              "input_cached_read": null,
              "input_cache_write": null,
              "output": null
            },
            "agent": null
          }
        ],
        "duration_seconds": null
      },
      "review_ready_at": "2026-08-27T01:37:26-03:00",
      "review_started_at": "2026-08-27T01:37:26-03:00"
    }
  ],
  "delivery_loops": [
    {
      "number": 1,
      "spec_revision": 2,
      "git_commit": null,
      "execution_outcome": "ready_for_review",
      "code_generation": {
        "created_at": "2026-08-27T01:40:00-03:00",
        "created_by": "human:eugenioserrano",
        "runs": [
          {
            "tool": "opencode",
            "provider": "deepseek",
            "model": "deepseek/deepseek-v4-flash",
            "tokens": {
              "input_uncached": null,
              "input_cached_read": null,
              "input_cache_write": null,
              "output": null
            },
            "agent": null
          }
        ],
        "duration_seconds": null
      },
      "mem": {
        "ref": "metaflow/22-memory/MEM-260827-0140-bolt001-engine-transformacion.md",
        "generation": {
          "created_at": "2026-08-27T01:40:00-03:00",
          "created_by": "human:eugenioserrano",
          "runs": [
            {
              "tool": "opencode",
              "provider": "deepseek",
              "model": "deepseek/deepseek-v4-flash",
              "tokens": {
                "input_uncached": null,
                "input_cached_read": null,
                "input_cache_write": null,
                "output": null
              },
              "agent": null
            }
          ],
          "duration_seconds": null
        }
      },
      "review_ready_at": "2026-08-27T01:40:00-03:00",
      "review_started_at": "2026-08-27T01:41:53-03:00"
    }
  ],
  "checkpoint_approvals": [
    {
      "checkpoint": "CP-US-Approval",
      "subject": {
        "ref": "metaflow/12-functional/user-stories/US-001-toolkit-transformacion.md"
      },
      "decision": "approved",
      "decided_by": [
        {
          "actor": "human:eugenioserrano",
          "role": "functional_analyst",
          "model": null
        }
      ],
      "decided_at": "2026-08-27T01:17:43-03:00",
      "comment": "Origen: US-001 aprobada (5 SP)"
    },
    {
      "checkpoint": "CP-TASK-READY-Approval",
      "subject": {
        "ref": "metaflow/12-functional/tasks/US-001.TASK-001-engine-transformacion.md"
      },
      "decision": "approved",
      "decided_by": [
        {
          "actor": "human:eugenioserrano",
          "role": "functional_analyst",
          "model": null
        }
      ],
      "decided_at": "2026-08-27T01:23:11-03:00",
      "comment": "DoR verificado: US-001 aprobada, ADR-001 aceptada, OQs cerradas; riesgo low confirmado"
    },
    {
      "checkpoint": "CP-SPEC-Approval",
      "subject": {
        "ref": "metaflow/21-spec/SPEC-260827-0124-bolt001-engine-transformacion.md",
        "revision": 1
      },
      "decision": "approved",
      "decided_by": [
        {
          "actor": "human:eugenioserrano",
          "role": "dev_validator",
          "model": null
        }
      ],
      "decided_at": "2026-08-27T01:30:09-03:00",
      "comment": "Aprobación del propietario (Dev-validator autoasignado) sin hallazgos; autoriza el V-Bounce de TASK-001"
    },
    {
      "checkpoint": "CP-SPEC-Approval",
      "subject": {
        "ref": "metaflow/21-spec/SPEC-260827-0124-bolt001-engine-transformacion.md",
        "revision": 2
      },
      "decision": "approved",
      "decided_by": [
        {
          "actor": "human:eugenioserrano",
          "role": "dev_validator",
          "model": null
        }
      ],
      "decided_at": "2026-08-27T01:37:26-03:00",
      "comment": "Re-aprobación Revisión 2 (exclusiones TEMPLATE-REPORT.html) sin hallazgos — G15 cumplido; el V-Bounce se ejecuta bajo la revisión 2"
    },
    {
      "checkpoint": "CP-MEM-Approval",
      "subject": {
        "ref": "metaflow/22-memory/MEM-260827-0140-bolt001-engine-transformacion.md",
        "delivery_loop": 1
      },
      "decision": "approved",
      "decided_by": [
        {
          "actor": "human:eugenioserrano",
          "role": "dev_validator",
          "model": null
        }
      ],
      "decided_at": "2026-08-27T01:41:53-03:00",
      "comment": "Aprobación sin hallazgos — diff, tests 37/37, gates y manifest revisados; TASK-001 Development Completed"
    },
    {
      "checkpoint": "CP-TASK-DONE-Approval",
      "subject": {
        "ref": "metaflow/12-functional/tasks/US-001.TASK-001-engine-transformacion.md"
      },
      "decision": "approved",
      "decided_by": [
        {
          "actor": "human:eugenioserrano",
          "role": "product_owner",
          "model": null
        }
      ],
      "decided_at": "2026-08-27T02:06:25-03:00",
      "comment": "Aceptación final sin hallazgos — demo: dry-run, ejecución real y fixture E2E; TASK-001 Done"
    }
  ]
}
