{
  "schema_version": "1.0",
  "task": {
    "id": "US-001.TASK-030",
    "type": "functional",
    "ref": "metaflow/12-functional/tasks/US-001.TASK-030-fix-skill-metaflow.md",
    "sources": [
      "metaflow/12-functional/user-stories/US-001-toolkit-transformacion.md",
      "metaflow/13-bugs/BUG-025-skill-metaflow-no-reproducible.md",
      "metaflow/11-adrs/ADR-001-toolkit-transformacion.md"
    ],
    "generation": {
      "created_at": "2026-08-27T22:25:49-03:00",
      "created_by": "human:eugenioserrano",
      "runs": [
        {
          "tool": "opencode",
          "provider": "deepseek",
          "model": "deepseek/deepseek-v4-flash",
          "tokens": {
            "input_uncached": null,
            "input_cached_read": null,
            "input_cache_write": null,
            "output": null
          },
          "agent": null
        }
      ],
      "duration_seconds": null
    },
    "review_ready_at": "2026-08-27T22:25:49-03:00",
    "review_started_at": "2026-08-27T22:28:00-03:00",
    "acceptance": {
      "review_ready_at": "2026-08-27T22:42:00-03:00",
      "review_started_at": "2026-08-27T22:42:00-03:00"
    }
  },
  "spec_revisions": [
    {
      "revision": 1,
      "ref": "metaflow/21-spec/SPEC-260827-2229-fix-skill-metaflow.md",
      "sources": [
        "metaflow/12-functional/tasks/US-001.TASK-030-fix-skill-metaflow.md"
      ],
      "git_commit": null,
      "generation": {
        "created_at": "2026-08-27T22:29:00-03:00",
        "created_by": "human:eugenioserrano",
        "runs": [
          {
            "tool": "opencode",
            "provider": "deepseek",
            "model": "deepseek/deepseek-v4-flash",
            "tokens": {
              "input_uncached": null,
              "input_cached_read": null,
              "input_cache_write": null,
              "output": null
            },
            "agent": null
          }
        ],
        "duration_seconds": null
      },
      "review_ready_at": "2026-08-27T22:29:00-03:00",
      "review_started_at": "2026-08-27T22:32:42-03:00"
    }
  ],
  "delivery_loops": [
    {
      "number": 1,
      "spec_revision": 1,
      "git_commit": null,
      "execution_outcome": "ready_for_review",
      "code_generation": {
        "created_at": "2026-08-27T22:38:35-03:00",
        "created_by": "human:eugenioserrano",
        "runs": [
          {
            "tool": "opencode",
            "provider": "deepseek",
            "model": "deepseek/deepseek-v4-flash",
            "tokens": {
              "input_uncached": null,
              "input_cached_read": null,
              "input_cache_write": null,
              "output": null
            },
            "agent": null
          }
        ],
        "duration_seconds": null
      },
      "mem": {
        "ref": "metaflow/22-memory/MEM-260827-2238-fix-skill-metaflow.md",
        "generation": {
          "created_at": "2026-08-27T22:38:35-03:00",
          "created_by": "human:eugenioserrano",
          "runs": [
            {
              "tool": "opencode",
              "provider": "deepseek",
              "model": "deepseek/deepseek-v4-flash",
              "tokens": {
                "input_uncached": null,
                "input_cached_read": null,
                "input_cache_write": null,
                "output": null
              },
              "agent": null
            }
          ],
          "duration_seconds": null
        }
      },
      "review_ready_at": "2026-08-27T22:38:35-03:00",
      "review_started_at": "2026-08-27T22:39:55-03:00"
    }
  ],
  "checkpoint_approvals": [
    {
      "checkpoint": "CP-US-Approval",
      "subject": {
        "ref": "metaflow/12-functional/user-stories/US-001-toolkit-transformacion.md"
      },
      "decision": "approved",
      "decided_by": [
        {
          "actor": "human:eugenioserrano",
          "role": "functional_analyst",
          "model": null
        }
      ],
      "decided_at": "2026-08-27T01:17:43-03:00",
      "comment": null
    },
    {
      "checkpoint": "CP-BUG-Approval",
      "subject": {
        "ref": "metaflow/13-bugs/BUG-025-skill-metaflow-no-reproducible.md"
      },
      "decision": "approved",
      "decided_by": [
        {
          "actor": "human:eugenioserrano",
          "role": "functional_analyst",
          "model": null
        }
      ],
      "decided_at": "2026-08-27T22:25:49-03:00",
      "comment": null
    },
    {
      "checkpoint": "CP-TASK-READY-Approval",
      "subject": {
        "ref": "metaflow/12-functional/tasks/US-001.TASK-030-fix-skill-metaflow.md"
      },
      "decision": "approved",
      "decided_by": [
        {
          "actor": "human:eugenioserrano",
          "role": "functional_analyst",
          "model": null
        }
      ],
      "decided_at": "2026-08-27T22:28:00-03:00",
      "comment": null
    },
    {
      "checkpoint": "CP-SPEC-Approval",
      "subject": {
        "ref": "metaflow/21-spec/SPEC-260827-2229-fix-skill-metaflow.md",
        "revision": 1
      },
      "decision": "approved",
      "decided_by": [
        {
          "actor": "human:eugenioserrano",
          "role": "dev_validator",
          "model": null
        }
      ],
      "decided_at": "2026-08-27T22:32:42-03:00",
      "comment": null
    },
    {
      "checkpoint": "CP-MEM-Approval",
      "subject": {
        "ref": "metaflow/22-memory/MEM-260827-2238-fix-skill-metaflow.md",
        "delivery_loop": 1
      },
      "decision": "approved",
      "decided_by": [
        {
          "actor": "human:eugenioserrano",
          "role": "dev_validator",
          "model": null
        }
      ],
      "decided_at": "2026-08-27T22:39:55-03:00",
      "comment": null
    },
    {
      "checkpoint": "CP-TASK-DONE-Approval",
      "subject": {
        "ref": "metaflow/12-functional/tasks/US-001.TASK-030-fix-skill-metaflow.md"
      },
      "decision": "approved",
      "decided_by": [
        {
          "actor": "human:eugenioserrano",
          "role": "product_owner",
          "model": null
        }
      ],
      "decided_at": "2026-08-27T22:42:00-03:00",
      "comment": null
    }
  ]
}