{
  "schema_version": "1.0",
  "task": {
    "id": "US-001.TASK-003",
    "type": "functional",
    "ref": "metaflow/12-functional/tasks/US-001.TASK-003-versionado-y-limpieza.md",
    "sources": [
      "metaflow/12-functional/user-stories/US-001-toolkit-transformacion.md",
      "metaflow/11-adrs/ADR-001-toolkit-transformacion.md",
      "metaflow/02-analysis/glossary/metaflow.md",
      "metaflow/02-analysis/domain-model/entities/DistributionKit.md"
    ],
    "generation": {
      "created_at": "2026-08-27T02:10:15-03:00",
      "created_by": "human:eugenioserrano",
      "runs": [
        {
          "tool": "opencode",
          "provider": "deepseek",
          "model": "deepseek/deepseek-v4-flash",
          "tokens": {
            "input_uncached": null,
            "input_cached_read": null,
            "input_cache_write": null,
            "output": null
          },
          "agent": null
        }
      ],
      "duration_seconds": null
    },
    "review_ready_at": "2026-08-27T02:10:15-03:00",
    "review_started_at": "2026-08-27T02:11:30-03:00",
    "acceptance": {
      "review_ready_at": null,
      "review_started_at": null
    }
  },
  "spec_revisions": [
    {
      "revision": 1,
      "ref": "metaflow/21-spec/SPEC-260827-0211-bolt003-versionado-limpieza.md",
      "sources": [
        "metaflow/12-functional/tasks/US-001.TASK-003-versionado-y-limpieza.md",
        "metaflow/12-functional/user-stories/US-001-toolkit-transformacion.md",
        "metaflow/11-adrs/ADR-001-toolkit-transformacion.md"
      ],
      "git_commit": null,
      "generation": {
        "created_at": "2026-08-27T02:14:12-03:00",
        "created_by": "human:eugenioserrano",
        "runs": [
          {
            "tool": "opencode",
            "provider": "deepseek",
            "model": "deepseek/deepseek-v4-flash",
            "tokens": {
              "input_uncached": null,
              "input_cached_read": null,
              "input_cache_write": null,
              "output": null
            },
            "agent": null
          }
        ],
        "duration_seconds": null
      },
      "review_ready_at": "2026-08-27T02:11:30-03:00",
      "review_started_at": "2026-08-27T02:14:12-03:00"
    },
    {
      "revision": 2,
      "ref": "metaflow/21-spec/SPEC-260827-0211-bolt003-versionado-limpieza.md",
      "sources": [
        "metaflow/12-functional/tasks/US-001.TASK-003-versionado-y-limpieza.md",
        "metaflow/12-functional/user-stories/US-001-toolkit-transformacion.md",
        "metaflow/11-adrs/ADR-001-toolkit-transformacion.md"
      ],
      "git_commit": null,
      "generation": {
        "created_at": "2026-08-27T02:21:03-03:00",
        "created_by": "human:eugenioserrano",
        "runs": [
          {
            "tool": "opencode",
            "provider": "deepseek",
            "model": "deepseek/deepseek-v4-flash",
            "tokens": {
              "input_uncached": null,
              "input_cached_read": null,
              "input_cache_write": null,
              "output": null
            },
            "agent": null
          }
        ],
        "duration_seconds": null
      },
      "review_ready_at": "2026-08-27T02:21:03-03:00",
      "review_started_at": "2026-08-27T02:21:03-03:00"
    }
  ],
  "delivery_loops": [
    {
      "number": 1,
      "spec_revision": 1,
      "git_commit": null,
      "execution_outcome": "ready_for_review",
      "code_generation": {
        "created_at": "2026-08-27T02:17:11-03:00",
        "created_by": "human:eugenioserrano",
        "runs": [
          {
            "tool": "opencode",
            "provider": "deepseek",
            "model": "deepseek/deepseek-v4-flash",
            "tokens": {
              "input_uncached": null,
              "input_cached_read": null,
              "input_cache_write": null,
              "output": null
            },
            "agent": null
          }
        ],
        "duration_seconds": null
      },
      "mem": {
        "ref": "metaflow/22-memory/MEM-260827-0217-bolt003-versionado-limpieza.md",
        "generation": {
          "created_at": "2026-08-27T02:17:11-03:00",
          "created_by": "human:eugenioserrano",
          "runs": [
            {
              "tool": "opencode",
              "provider": "deepseek",
              "model": "deepseek/deepseek-v4-flash",
              "tokens": {
                "input_uncached": null,
                "input_cached_read": null,
                "input_cache_write": null,
                "output": null
              },
              "agent": null
            }
          ],
          "duration_seconds": null
        }
      },
      "review_ready_at": "2026-08-27T02:17:11-03:00",
      "review_started_at": "2026-08-27T02:26:19-03:00"
    },
    {
      "number": 2,
      "spec_revision": 2,
      "git_commit": null,
      "execution_outcome": "ready_for_review",
      "code_generation": {
        "created_at": "2026-08-27T02:25:17-03:00",
        "created_by": "human:eugenioserrano",
        "runs": [
          {
            "tool": "opencode",
            "provider": "deepseek",
            "model": "deepseek/deepseek-v4-flash",
            "tokens": {
              "input_uncached": null,
              "input_cached_read": null,
              "input_cache_write": null,
              "output": null
            },
            "agent": null
          }
        ],
        "duration_seconds": null
      },
      "mem": {
        "ref": "metaflow/22-memory/MEM-260827-0225-bolt003-familia-manifests-v1.md",
        "generation": {
          "created_at": "2026-08-27T02:25:17-03:00",
          "created_by": "human:eugenioserrano",
          "runs": [
            {
              "tool": "opencode",
              "provider": "deepseek",
              "model": "deepseek/deepseek-v4-flash",
              "tokens": {
                "input_uncached": null,
                "input_cached_read": null,
                "input_cache_write": null,
                "output": null
              },
              "agent": null
            }
          ],
          "duration_seconds": null
        }
      },
      "review_ready_at": "2026-08-27T02:25:17-03:00",
      "review_started_at": "2026-08-27T02:26:19-03:00"
    }
  ],
  "checkpoint_approvals": [
    {
      "checkpoint": "CP-US-Approval",
      "subject": {
        "ref": "metaflow/12-functional/user-stories/US-001-toolkit-transformacion.md"
      },
      "decision": "approved",
      "decided_by": [
        {
          "actor": "human:eugenioserrano",
          "role": "functional_analyst",
          "model": null
        }
      ],
      "decided_at": "2026-08-27T01:17:43-03:00",
      "comment": "Origen: US-001 aprobada (5 SP)"
    },
    {
      "checkpoint": "CP-TASK-READY-Approval",
      "subject": {
        "ref": "metaflow/12-functional/tasks/US-001.TASK-003-versionado-y-limpieza.md"
      },
      "decision": "approved",
      "decided_by": [
        {
          "actor": "human:eugenioserrano",
          "role": "functional_analyst",
          "model": null
        }
      ],
      "decided_at": "2026-08-27T02:11:30-03:00",
      "comment": "DoR verificado: US-001 aprobada, ADR-001 aceptada, TASK-001/002 Done, OQs cerradas; riesgo low confirmado; neutralización de citas Accelerate aceptada"
    },
    {
      "checkpoint": "CP-SPEC-Approval",
      "subject": {
        "ref": "metaflow/21-spec/SPEC-260827-0211-bolt003-versionado-limpieza.md",
        "revision": 1
      },
      "decision": "approved",
      "decided_by": [
        {
          "actor": "human:eugenioserrano",
          "role": "dev_validator",
          "model": null
        }
      ],
      "decided_at": "2026-08-27T02:14:12-03:00",
      "comment": "Aprobación sin hallazgos; autoriza el V-Bounce 3 de TASK-003"
    },
    {
      "checkpoint": "CP-SPEC-Approval",
      "subject": {
        "ref": "metaflow/21-spec/SPEC-260827-0211-bolt003-versionado-limpieza.md",
        "revision": 2
      },
      "decision": "approved",
      "decided_by": [
        {
          "actor": "human:eugenioserrano",
          "role": "dev_validator",
          "model": null
        }
      ],
      "decided_at": "2026-08-27T02:21:03-03:00",
      "comment": "Re-aprobación Revisión 2 (familia de manifests v1, regla genérica −4 con placeholders) sin hallazgos — G15 cumplido"
    },
    {
      "checkpoint": "CP-MEM-Approval",
      "subject": {
        "ref": "metaflow/22-memory/MEM-260827-0217-bolt003-versionado-limpieza.md",
        "delivery_loop": 1
      },
      "decision": "approved",
      "decided_by": [
        {
          "actor": "human:eugenioserrano",
          "role": "dev_validator",
          "model": null
        }
      ],
      "decided_at": "2026-08-27T02:26:19-03:00",
      "comment": "Aprobación sin hallazgos — versiones por contexto y Accelerate neutralizado; tests 62/62"
    },
    {
      "checkpoint": "CP-MEM-Approval",
      "subject": {
        "ref": "metaflow/22-memory/MEM-260827-0225-bolt003-familia-manifests-v1.md",
        "delivery_loop": 2
      },
      "decision": "approved",
      "decided_by": [
        {
          "actor": "human:eugenioserrano",
          "role": "dev_validator",
          "model": null
        }
      ],
      "decided_at": "2026-08-27T02:26:19-03:00",
      "comment": "Aprobación sin hallazgos — familia de manifests v1 y regla genérica −4; tests 64/64"
    }
  ]
}
