{
  "schema_version": "1.0",
  "task": {
    "id": "US-000.TASK-002",
    "type": "non-functional",
    "ref": "metaflow/12-functional/tasks/US-000.TASK-002-eliminacion-track-tools.md",
    "sources": [
      "metaflow/12-functional/user-stories/US-000-non-functional.md",
      "metaflow/11-adrs/ADR-001-toolkit-transformacion.md",
      "metaflow/02-analysis/vision/vision.md",
      "metaflow/02-analysis/scope/mvp-scope.md"
    ],
    "generation": {
      "created_at": "2026-08-28T01:17:51-03:00",
      "created_by": "human:eugenioserrano",
      "runs": [
        {
          "tool": "opencode",
          "provider": "deepseek",
          "model": "deepseek/deepseek-v4-flash",
          "tokens": {
            "input_uncached": null,
            "input_cached_read": null,
            "input_cache_write": null,
            "output": null
          },
          "agent": null
        }
      ],
      "duration_seconds": null
    },
    "review_ready_at": "2026-08-28T01:17:51-03:00",
    "review_started_at": "2026-08-28T01:18:30-03:00",
    "acceptance": {
      "review_ready_at": "2026-08-28T01:27:00-03:00",
      "review_started_at": "2026-08-28T01:27:05-03:00"
    }
  },
  "spec_revisions": [
    {
      "revision": 1,
      "ref": "metaflow/21-spec/SPEC-260828-0119-eliminacion-track-tools.md",
      "sources": [
        "metaflow/12-functional/tasks/US-000.TASK-002-eliminacion-track-tools.md",
        "metaflow/11-adrs/ADR-001-toolkit-transformacion.md"
      ],
      "git_commit": null,
      "generation": {
        "created_at": "2026-08-28T01:19:22-03:00",
        "created_by": "human:eugenioserrano",
        "runs": [
          {
            "tool": "opencode",
            "provider": "deepseek",
            "model": "deepseek/deepseek-v4-flash",
            "tokens": {
              "input_uncached": null,
              "input_cached_read": null,
              "input_cache_write": null,
              "output": null
            },
            "agent": null
          }
        ],
        "duration_seconds": null
      },
      "review_ready_at": "2026-08-28T01:19:22-03:00",
      "review_started_at": "2026-08-28T01:21:30-03:00"
    }
  ],
  "delivery_loops": [
    {
      "number": 1,
      "spec_revision": 1,
      "git_commit": null,
      "execution_outcome": "ready_for_review",
      "code_generation": {
        "created_at": "2026-08-28T01:22:27-03:00",
        "created_by": "human:eugenioserrano",
        "runs": [
          {
            "tool": "opencode",
            "provider": "deepseek",
            "model": "deepseek/deepseek-v4-flash",
            "tokens": {
              "input_uncached": null,
              "input_cached_read": null,
              "input_cache_write": null,
              "output": null
            },
            "agent": null
          }
        ],
        "duration_seconds": null
      },
      "mem": {
        "ref": "metaflow/22-memory/MEM-260828-0125-eliminacion-track-tools.md",
        "generation": {
          "created_at": "2026-08-28T01:25:28-03:00",
          "created_by": "human:eugenioserrano",
          "runs": [
            {
              "tool": "opencode",
              "provider": "deepseek",
              "model": "deepseek/deepseek-v4-flash",
              "tokens": {
                "input_uncached": null,
                "input_cached_read": null,
                "input_cache_write": null,
                "output": null
              },
              "agent": null
            }
          ],
          "duration_seconds": null
        }
      },
      "review_ready_at": "2026-08-28T01:25:28-03:00",
      "review_started_at": "2026-08-28T01:26:00-03:00"
    }
  ],
  "checkpoint_approvals": [
    {
      "checkpoint": "CP-TASK-READY-Approval",
      "subject": {
        "ref": "metaflow/12-functional/tasks/US-000.TASK-002-eliminacion-track-tools.md"
      },
      "decision": "approved",
      "decided_by": [
        {
          "actor": "human:eugenioserrano",
          "role": "architect",
          "model": null
        }
      ],
      "decided_at": "2026-08-28T01:19:22-03:00",
      "comment": "DoR validado: revisión de referencias hecha (2026-08-28), alcance y exclusiones definidos"
    },
    {
      "checkpoint": "CP-SPEC-Approval",
      "subject": {
        "ref": "metaflow/21-spec/SPEC-260828-0119-eliminacion-track-tools.md",
        "revision": 1
      },
      "decision": "approved",
      "decided_by": [
        {
          "actor": "human:eugenioserrano",
          "role": "dev_validator",
          "model": null
        }
      ],
      "decided_at": "2026-08-28T01:22:27-03:00",
      "comment": null
    },
    {
      "checkpoint": "CP-MEM-Approval",
      "subject": {
        "ref": "metaflow/22-memory/MEM-260828-0125-eliminacion-track-tools.md",
        "delivery_loop": 1
      },
      "decision": "approved",
      "decided_by": [
        {
          "actor": "human:eugenioserrano",
          "role": "dev_validator",
          "model": null
        }
      ],
      "decided_at": "2026-08-28T01:26:57-03:00",
      "comment": "Evidencia revisada: diff + 106 tests OK + AC-1..AC-5 verificadas"
    },
    {
      "checkpoint": "CP-TASK-DONE-Approval",
      "subject": {
        "ref": "metaflow/12-functional/tasks/US-000.TASK-002-eliminacion-track-tools.md"
      },
      "decision": "approved",
      "decided_by": [
        {
          "actor": "human:eugenioserrano",
          "role": "tech_lead",
          "model": null
        }
      ],
      "decided_at": "2026-08-28T01:27:22-03:00",
      "comment": "Aceptación (routing debt → Tech Lead): repo sin track heredado, suite 106 OK, grep sin restos"
    }
  ]
}
