{
  "schema_version": "1.0",
  "task": {
    "id": "US-001.TASK-023",
    "type": "functional",
    "ref": "metaflow/12-functional/tasks/US-001.TASK-023-fix-g05-pre-v5.md",
    "sources": [
      "metaflow/12-functional/user-stories/US-001-toolkit-transformacion.md",
      "metaflow/13-bugs/BUG-018-g05-pre-v5-citl.md",
      "metaflow/31-reviews/REV-004-analisis-fresco-kit.md",
      "metaflow/11-adrs/ADR-001-toolkit-transformacion.md"
    ],
    "generation": {
      "created_at": "2026-08-27T10:30:00-03:00",
      "created_by": "human:eugenioserrano",
      "runs": [
        {
          "tool": "opencode",
          "provider": "deepseek",
          "model": "deepseek/deepseek-v4-flash",
          "tokens": {
            "input_uncached": null,
            "input_cached_read": null,
            "input_cache_write": null,
            "output": null
          },
          "agent": null
        }
      ],
      "duration_seconds": null
    },
    "review_ready_at": "2026-08-27T10:30:00-03:00",
    "review_started_at": "2026-08-27T10:29:01-03:00",
    "acceptance": {
      "review_ready_at": "2026-08-27T10:34:00-03:00",
      "review_started_at": "2026-08-27T10:34:00-03:00"
    }
  },
  "spec_revisions": [
    {
      "revision": 1,
      "ref": "metaflow/21-spec/SPEC-260827-1029-fix-g05-pre-v5.md",
      "sources": [
        "metaflow/12-functional/tasks/US-001.TASK-023-fix-g05-pre-v5.md",
        "metaflow/13-bugs/BUG-018-g05-pre-v5-citl.md",
        "metaflow/31-reviews/REV-004-analisis-fresco-kit.md"
      ],
      "git_commit": null,
      "generation": {
        "created_at": "2026-08-27T10:29:01-03:00",
        "created_by": "human:eugenioserrano",
        "runs": [
          {
            "tool": "opencode",
            "provider": "deepseek",
            "model": "deepseek/deepseek-v4-flash",
            "tokens": {
              "input_uncached": null,
              "input_cached_read": null,
              "input_cache_write": null,
              "output": null
            },
            "agent": null
          }
        ],
        "duration_seconds": null
      },
      "review_ready_at": "2026-08-27T10:29:01-03:00",
      "review_started_at": "2026-08-27T10:29:01-03:00"
    }
  ],
  "delivery_loops": [
    {
      "number": 1,
      "spec_revision": 1,
      "git_commit": null,
      "execution_outcome": "ready_for_review",
      "code_generation": {
        "created_at": "2026-08-27T10:34:00-03:00",
        "created_by": "human:eugenioserrano",
        "runs": [
          {
            "tool": "opencode",
            "provider": "deepseek",
            "model": "deepseek/deepseek-v4-flash",
            "tokens": {
              "input_uncached": null,
              "input_cached_read": null,
              "input_cache_write": null,
              "output": null
            },
            "agent": null
          }
        ],
        "duration_seconds": null
      },
      "mem": {
        "ref": "metaflow/22-memory/MEM-260827-1034-fix-g05-pre-v5.md",
        "generation": {
          "created_at": "2026-08-27T10:34:00-03:00",
          "created_by": "human:eugenioserrano",
          "runs": [
            {
              "tool": "opencode",
              "provider": "deepseek",
              "model": "deepseek/deepseek-v4-flash",
              "tokens": {
                "input_uncached": null,
                "input_cached_read": null,
                "input_cache_write": null,
                "output": null
              },
              "agent": null
            }
          ],
          "duration_seconds": null
        }
      },
      "review_ready_at": "2026-08-27T10:34:00-03:00",
      "review_started_at": "2026-08-27T10:34:00-03:00"
    }
  ],
  "checkpoint_approvals": [
    {
      "checkpoint": "CP-US-Approval",
      "subject": {
        "ref": "metaflow/12-functional/user-stories/US-001-toolkit-transformacion.md"
      },
      "decision": "approved",
      "decided_by": [
        {
          "actor": "human:eugenioserrano",
          "role": "functional_analyst",
          "model": null
        }
      ],
      "decided_at": "2026-08-27T01:17:43-03:00",
      "comment": "Origen: US-001 aprobada (5 SP)"
    },
    {
      "checkpoint": "CP-BUG-Approval",
      "subject": {
        "ref": "metaflow/13-bugs/BUG-018-g05-pre-v5-citl.md"
      },
      "decision": "approved",
      "decided_by": [
        {
          "actor": "human:eugenioserrano",
          "role": "functional_analyst",
          "model": null
        }
      ],
      "decided_at": "2026-08-27T10:30:00-03:00",
      "comment": "Origen: BUG-018 aprobado (REV-004, CP-REV-Approval 2026-08-27)"
    },
    {
      "checkpoint": "CP-TASK-READY-Approval",
      "subject": {
        "ref": "metaflow/12-functional/tasks/US-001.TASK-023-fix-g05-pre-v5.md"
      },
      "decision": "approved",
      "decided_by": [
        {
          "actor": "human:eugenioserrano",
          "role": "functional_analyst",
          "model": null
        }
      ],
      "decided_at": "2026-08-27T10:29:01-03:00",
      "comment": "DoR verificado: US-001 aprobada, BUG-NNN aprobado, REV-004 aprobado, ADR-001 accepted; riesgo low confirmado (aprobación en bloque TASK-018..024)"
    },
    {
      "checkpoint": "CP-SPEC-Approval",
      "subject": {
        "ref": "metaflow/21-spec/SPEC-260827-1029-fix-g05-pre-v5.md",
        "revision": 1
      },
      "decision": "approved",
      "decided_by": [
        {
          "actor": "human:eugenioserrano",
          "role": "dev_validator",
          "model": null
        }
      ],
      "decided_at": "2026-08-27T10:29:01-03:00",
      "comment": "Aprobación sin hallazgos; autoriza el V-Bounce de US-001.TASK-023 (TDD estricto, red→green)"
    },
    {
      "checkpoint": "CP-MEM-Approval",
      "subject": {
        "ref": "metaflow/22-memory/MEM-260827-1034-fix-g05-pre-v5.md",
        "delivery_loop": 1
      },
      "decision": "approved",
      "decided_by": [
        {
          "actor": "human:eugenioserrano",
          "role": "dev_validator",
          "model": null
        }
      ],
      "decided_at": "2026-08-27T10:34:00-03:00",
      "comment": "Aprobación sin hallazgos — paquete aprobado en bloque (TASK-018..024); diff + evidencia RED/GREEN + MEM + manifest revisados; 91 tests OK, cero restos"
    },
    {
      "checkpoint": "CP-TASK-DONE-Approval",
      "subject": {
        "ref": "metaflow/12-functional/tasks/US-001.TASK-023-fix-g05-pre-v5.md"
      },
      "decision": "approved",
      "decided_by": [
        {
          "actor": "human:eugenioserrano",
          "role": "product_owner",
          "model": null
        }
      ],
      "decided_at": "2026-08-27T10:34:00-03:00",
      "comment": "Aceptación del propietario (PO autoasignado) — demo: kit regenerado sin el patrón del BUG; suite 91/91; BOLT Done"
    }
  ]
}